{"$schema":"https://json-schema.org/draft/2020-12/schema","$id":"split-manifest.v1","type":"object","additionalProperties":false,"required":["schema_version","seed","train_ids","validation_ids","test_ids"],"properties":{"schema_version":{"const":"split-manifest.v1"},"seed":{"type":"integer"},"train_ids":{"type":"array","minItems":1,"uniqueItems":true,"items":{"type":"string","pattern":"^seq-[0-9]{6}$"}},"validation_ids":{"type":"array","minItems":1,"uniqueItems":true,"items":{"type":"string","pattern":"^seq-[0-9]{6}$"}},"test_ids":{"type":"array","minItems":1,"uniqueItems":true,"items":{"type":"string","pattern":"^seq-[0-9]{6}$"}}}}
